{
  "available_evidence": [
    {
      "evidence_id": "evidence-ae-raw-source",
      "evidence_type": "registered_source",
      "reference": "input/edc/ae09jun2025.sas7bdat",
      "sha256": "2a6d72e9e5fa4bb8e3cc14b0c412fce3c37e519f3ab9105cdcff33ba031e8749",
      "status": "available"
    },
    {
      "evidence_id": "evidence-source-metadata",
      "evidence_type": "source_metadata",
      "reference": "work/derived/edc/source-metadata.json",
      "sha256": "2a6d72e9e5fa4bb8e3cc14b0c412fce3c37e519f3ab9105cdcff33ba031e8749",
      "status": "available"
    },
    {
      "evidence_id": "evidence-governed-knowledge",
      "evidence_type": "knowledge_snapshot",
      "reference": "clinical-llm-wiki/snapshots/snapshot-sdtmig34-core-events-ae-v1.json",
      "sha256": "d8aafb73ccca987d597e372435b664ba074c1a45688d5e2eef809c72f475a9ec",
      "status": "available"
    }
  ],
  "blocked_variables": [],
  "conditional": [
    {
      "affects_variables": [
        "AESTDY",
        "AEENDY"
      ],
      "blocking": false,
      "classification": "conditional",
      "evidence_refs": [
        "input/raw/subject-reference.csv"
      ],
      "reason": "Reference-date source is available for study-day candidates",
      "requirement_id": "reference_date_source",
      "status": "available"
    },
    {
      "affects_variables": [
        "AEDECOD",
        "AEBODSYS",
        "AESOC"
      ],
      "blocking": false,
      "classification": "conditional",
      "evidence_refs": [
        "source-metadata#variables/AETERM_PT",
        "source-metadata#variables/AETERM_SOC",
        "source-metadata#variables/AETERM_SOC"
      ],
      "reason": "Raw metadata contains PT/SOC coding candidates; dictionary/version still require Mapping review",
      "requirement_id": "meddra_coding_source",
      "status": "available"
    },
    {
      "affects_variables": [],
      "blocking": false,
      "classification": "conditional",
      "evidence_refs": [
        "input/crf/ae-crf-fields.csv"
      ],
      "reason": "CRF metadata is available as supporting evidence",
      "requirement_id": "crf_metadata",
      "status": "available"
    }
  ],
  "creates_stage_completion_evidence": false,
  "execution_eligibility": "draft_allowed",
  "explicit_gaps": [
    {
      "affects_variables": [
        "AESEV",
        "AESER",
        "AEREL",
        "AEACN",
        "AEOUT"
      ],
      "blocking": false,
      "category": "source_metadata",
      "description": "Source file does not provide resolvable value-label mappings for controlled fields",
      "evidence_refs": [
        "source-metadata#metadata_availability/value_labels"
      ],
      "gap_id": "gap-controlled-value-labels",
      "required_action": "Use governed CT plus Mapping Review; do not infer labels from observed values"
    }
  ],
  "generated_at": "2026-07-17T09:22:17.978020+00:00",
  "optional": [
    {
      "affects_variables": [],
      "blocking": false,
      "classification": "optional",
      "evidence_refs": [
        "input/protocol/protocol-synopsis.txt"
      ],
      "reason": "Optional study_design_context is available",
      "requirement_id": "protocol_context",
      "status": "available"
    },
    {
      "affects_variables": [],
      "blocking": false,
      "classification": "optional",
      "evidence_refs": [
        "input/sap/sap-ae-excerpt.txt"
      ],
      "reason": "Optional analysis_context is available",
      "requirement_id": "sap_context",
      "status": "available"
    }
  ],
  "plan_id": "minimum-information-sample-ae-001-sdtm-ae-v1",
  "plan_sha256": "5ed456c4e10d8c55da7037b3aea33ce52354550175cd075a5e908d8541644711",
  "planner_version": "1.0.0",
  "producible_variables": [
    "STUDYID",
    "DOMAIN",
    "USUBJID",
    "AESEQ",
    "AETERM",
    "AESTDTC",
    "AEENDTC",
    "AESEV",
    "AESER",
    "AEREL",
    "AEACN",
    "AEOUT",
    "AEDECOD",
    "AEBODSYS",
    "AESOC",
    "AESTDY",
    "AEENDY"
  ],
  "required": [
    {
      "affects_variables": [
        "STUDYID",
        "DOMAIN",
        "USUBJID",
        "AESEQ",
        "AETERM",
        "AESTDTC",
        "AEENDTC",
        "AESEV",
        "AESER",
        "AEREL",
        "AEACN",
        "AEOUT",
        "AEDECOD",
        "AEBODSYS",
        "AESOC",
        "AESTDY",
        "AEENDY"
      ],
      "blocking": false,
      "classification": "required",
      "evidence_refs": [
        "input/edc/ae09jun2025.sas7bdat"
      ],
      "reason": "Registered AE raw source is available",
      "requirement_id": "ae_raw_dataset",
      "status": "available"
    },
    {
      "affects_variables": [
        "STUDYID",
        "DOMAIN",
        "USUBJID",
        "AESEQ",
        "AETERM",
        "AESTDTC",
        "AEENDTC",
        "AESEV",
        "AESER",
        "AEREL",
        "AEACN",
        "AEOUT",
        "AEDECOD",
        "AEBODSYS",
        "AESOC",
        "AESTDY",
        "AEENDY"
      ],
      "blocking": false,
      "classification": "required",
      "evidence_refs": [
        "work/derived/edc/source-metadata.json"
      ],
      "reason": "Source Metadata schema and raw source identity are valid",
      "requirement_id": "source_metadata",
      "status": "available"
    },
    {
      "affects_variables": [
        "STUDYID",
        "DOMAIN",
        "USUBJID",
        "AESEQ",
        "AETERM",
        "AESTDTC",
        "AEENDTC",
        "AESEV",
        "AESER",
        "AEREL",
        "AEACN",
        "AEOUT",
        "AEDECOD",
        "AEBODSYS",
        "AESOC",
        "AESTDY",
        "AEENDY"
      ],
      "blocking": false,
      "classification": "required",
      "evidence_refs": [
        "project.yaml#standards/sdtmig_version"
      ],
      "reason": "SDTMIG 3.4 is locked",
      "requirement_id": "target_standard",
      "status": "available"
    },
    {
      "affects_variables": [
        "STUDYID",
        "DOMAIN",
        "USUBJID",
        "AESEQ",
        "AETERM",
        "AESTDTC",
        "AEENDTC",
        "AESEV",
        "AESER",
        "AEREL",
        "AEACN",
        "AEOUT",
        "AEDECOD",
        "AEBODSYS",
        "AESOC",
        "AESTDY",
        "AEENDY"
      ],
      "blocking": false,
      "classification": "required",
      "evidence_refs": [
        "clinical-llm-wiki/snapshots/snapshot-sdtmig34-core-events-ae-v1.json"
      ],
      "reason": "Locked governed Wiki snapshot is available",
      "requirement_id": "governed_knowledge_snapshot",
      "status": "available"
    },
    {
      "affects_variables": [
        "USUBJID",
        "AESEQ"
      ],
      "blocking": false,
      "classification": "required",
      "evidence_refs": [
        "source-metadata#variables/Subject"
      ],
      "reason": "A registered subject-identity source candidate is present; derivation remains reviewable",
      "requirement_id": "subject_identity",
      "status": "available"
    }
  ],
  "required_reviews": [
    {
      "blocking_before": "mapping_context",
      "reason": "Confirm parser evidence and retain unavailable metadata as explicit gaps",
      "review_id": "source_intake_parser_ae_v1_001",
      "review_type": "source_intake"
    },
    {
      "blocking_before": "program_generation",
      "reason": "Approve source-to-target mappings and every evidence-dependent gap decision",
      "review_id": "sdtm_spec_ae_v1_001",
      "review_type": "sdtm_spec"
    }
  ],
  "required_wiki_queries": [
    {
      "purpose": "Load approved SDTMIG 3.4 AE structure and assumptions",
      "query_id": "wiki-query-ae-domain",
      "required_for_variables": [
        "STUDYID",
        "DOMAIN",
        "USUBJID",
        "AESEQ",
        "AETERM"
      ],
      "scope": "sdtm/events/ae",
      "snapshot_id": "snapshot-sdtmig34-core-events-ae-v1",
      "terms": [
        "AE",
        "AETERM",
        "one record per adverse event per subject"
      ]
    },
    {
      "purpose": "Load governed terminology constraints without inferring raw value labels",
      "query_id": "wiki-query-ae-controlled-terms",
      "required_for_variables": [
        "AESEV",
        "AESER",
        "AEREL",
        "AEACN",
        "AEOUT"
      ],
      "scope": "sdtm/controlled-terminology/ae",
      "snapshot_id": "snapshot-sdtmig34-core-events-ae-v1",
      "terms": [
        "AESEV",
        "AESER",
        "AEREL",
        "AEACN",
        "AEOUT"
      ]
    },
    {
      "purpose": "Load approved --DY calculation rule when reference dates are available",
      "query_id": "wiki-query-study-day",
      "required_for_variables": [
        "AESTDY",
        "AEENDY"
      ],
      "scope": "sdtm/core/study-day",
      "snapshot_id": "snapshot-sdtmig34-core-events-ae-v1",
      "terms": [
        "AESTDY",
        "AEENDY",
        "RFSTDTC"
      ]
    }
  ],
  "schema_version": "1.0.0",
  "source_metadata_artifact_id": "source-metadata-2a6d72e9e5fa",
  "study_id": "SAMPLE-AE-001",
  "target_artifact": "sdtm_ae_dataset",
  "target_standard": "SDTMIG",
  "target_standard_version": "3.4"
}
